{
  "$schema": "https://json-schema.org/draft/2020-12/schema",
  "$id": "https://example.invalid/orchestration/file_queue_linkage_consumer_observation.schema.json",
  "$comment": "BUILD_ID: 20260612_fasttrack_window3_readonly_linkage_consumer_schema_v0",
  "build_id": "20260613_ledger_consumer_static_hardening_v1",
  "title": "File Queue Linkage Consumer Observation",
  "type": "object",
  "additionalProperties": false,
  "required": [
    "schema",
    "observed_at_utc",
    "source_ledger_path",
    "latest_proof_id",
    "latest_proof_status",
    "next_action_recommendation",
    "owner_approval_required",
    "execution_allowed",
    "runtime_allowed",
    "reason"
  ],
  "properties": {
    "schema": {
      "type": "string",
      "const": "lonewolf.file_queue.linkage_consumer_observation.v1"
    },
    "build_id": {
      "type": "string",
      "enum": [
        "20260612_fasttrack_window3_readonly_linkage_consumer_fixture_v0",
        "20260613_ledger_consumer_static_hardening_v1"
      ]
    },
    "consumer_build_id": {
      "type": "string",
      "const": "20260612_fasttrack_window3_readonly_linkage_consumer_v0"
    },
    "observed_at_utc": {
      "type": "string",
      "format": "date-time"
    },
    "source_ledger_path": {
      "type": "string"
    },
    "latest_proof_id": {
      "type": "string"
    },
    "latest_proof_status": {
      "type": "string",
      "minLength": 1
    },
    "next_action_recommendation": {
      "type": "string",
      "minLength": 1
    },
    "owner_approval_required": {
      "type": "boolean",
      "const": true
    },
    "execution_allowed": {
      "type": "boolean",
      "const": false
    },
    "runtime_allowed": {
      "type": "boolean",
      "const": false
    },
    "reason": {
      "type": "string",
      "minLength": 1
    },
    "human_review_one_point": {
      "type": "string",
      "minLength": 1
    },
    "safety_summary": {
      "type": "object",
      "additionalProperties": false,
      "required": [
        "read_only",
        "no_task_execution",
        "no_daemon",
        "no_watcher",
        "no_queue_mutation",
        "appdata_only_default",
        "fixture_paths_only_in_tests"
      ],
      "properties": {
        "read_only": { "type": "boolean", "const": true },
        "no_task_execution": { "type": "boolean", "const": true },
        "no_daemon": { "type": "boolean", "const": true },
        "no_watcher": { "type": "boolean", "const": true },
        "no_queue_mutation": { "type": "boolean", "const": true },
        "appdata_only_default": { "type": "boolean", "const": true },
        "fixture_paths_only_in_tests": { "type": "boolean", "const": true }
      }
    },
    "forbidden_actions_confirmation": {
      "type": "object",
      "additionalProperties": false,
      "required": ["forbidden_actions_performed", "confirmed_absent"],
      "properties": {
        "forbidden_actions_performed": { "type": "boolean", "const": false },
        "confirmed_absent": {
          "type": "array",
          "items": { "type": "string", "minLength": 1 },
          "minItems": 1,
          "uniqueItems": true
        }
      }
    }
  }
}
